{
    "EnqueuedTimeUtc": "2020-05-02T21:01:08.1080000Z",
    "Properties": {
        "productId": "ReButton"
    },
    "SystemProperties": {
        "connectionDeviceId": "buttonDevOpsBuzzer1",
        "connectionAuthMethod": "{\"scope\":\"device\",\"type\":\"sas\",\"issuer\":\"iothub\",\"acceptingIpFilterRule\":null}",
        "connectionDeviceGenerationId": "637174884786996293",
        "contentType": "application/json",
        "contentEncoding": "utf-8",
        "enqueuedTime": "2020-05-02T21:01:08.1080000Z"
    },
    "Body": {
        "actionNum": "1",
        "message": "Single click",
        "singleClick": "Single click",
        "actionCount": 42
    }
}